id,type,difficulty,question,options,correct_answer,explanation
q1,mcq,hard,"Which of the following relational algebra operations is considered non-meaningful when performed alone but becomes meaningful when followed by other operations, especially selection?","UNION|INTERSECTION|CARTESIAN PRODUCT|SET DIFFERENCE",2,"The Cartesian Product operation merges columns from two relations, creating all possible combinations of tuples. It is not meaningful on its own, but becomes powerful when combined with a selection condition, often forming the basis for JOIN operations."
q2,true_false,hard,"In a Left Outer Join, if there is no matching tuple found in the right relation, the attributes of the left relation in the join result are filled with null values.",,false,"This statement is false. In a Left Outer Join, if there is no matching tuple found in the right relation, the attributes of the *right* relation in the join result are filled with null values, while all tuples from the left relation are kept."
q3,drag_drop,hard,"Match the RAID level to its primary characteristic.","drag1:RAID 0|drag2:RAID 1|drag3:RAID 5|drag4:RAID 6;drop1:Striping (Performance Only)|drop2:Mirroring (Fault Tolerance)|drop3:Striping with Distributed Parity|drop4:Striping with Double Parity;drag1:drop1|drag2:drop2|drag3:drop3|drag4:drop4","","RAID 0 offers striping for performance without fault tolerance. RAID 1 provides mirroring for fault tolerance. RAID 5 uses striping with distributed parity for a balance of performance and fault tolerance. RAID 6 adds a second parity block for even higher fault tolerance, allowing two simultaneous disk failures."
q4,mcq,hard,"Which of the following conditions is NOT a prerequisite for a deadlock to occur simultaneously?","Mutual Exclusion|Hold and Wait|Preemption|Circular Wait",2,"For a deadlock to occur, the condition is 'No Preemption', meaning resources cannot be forcibly taken. 'Preemption' would prevent a deadlock by allowing resources to be taken back."
q5,true_false,hard,"Third Normal Form (3NF) prohibits transitive dependencies, where a non-UID attribute is dependent on another non-UID attribute.",,true,"True. 3NF aims to eliminate transitive dependencies by ensuring that every non-UID attribute directly depends only on the primary key (UID) of its entity, not on other non-UID attributes."
q6,mcq,hard,"Which of the following is an example of a procedural business rule that might require additional programming rather than being diagrammed in an ERD?","A sales record includes product, buyer, quantity, price, and discount.|All restaurant orders must be handled by a staff member.|Any employee whose overtime exceeds 10 hours per week must be paid 1.5 times the hourly rate.|A library book must have a unique book ID number.",2,"Procedural business rules like 'Any employee whose overtime exceeds 10 hours per week must be paid 1.5 times the hourly rate' involve specific logic and calculations that typically need to be implemented through programming (e.g., in an application layer) rather than being represented solely within a static ERD."
q7,drag_drop,hard,"Match the Relational Algebra symbol to its operation.","drag_sym1:σ (sigma)|drag_sym2:π (pi)|drag_sym3:ρ (rho)|drag_sym4:⋈ (bowtie);drop_op1:SELECT (Restriction)|drop_op2:PROJECT|drop_op3:RENAME|drop_op4:JOIN;drag_sym1:drop_op1|drag_sym2:drop_op2|drag_sym3:drop_op3|drag_sym4:drop_op4","","σ (sigma) denotes SELECT (or Restriction), π (pi) denotes PROJECT, ρ (rho) denotes RENAME, and ⋈ (bowtie) denotes JOIN."
q8,mcq,hard,"Which RAID level provides striping with parity, allowing it to tolerate a single disk failure, and is commonly used for data warehouses?","RAID 0|RAID 1|RAID 5|RAID 6",2,"RAID 5 provides block-level striping with distributed parity, offering a balance of performance and fault tolerance (tolerates single disk failure). It's suitable for read-intensive applications like data warehouses."
q9,true_false,hard,"In Domain Relational Calculus (DRC), variables take values from tuples of relations, similar to Tuple Relational Calculus (TRC).",,false,"False. In Domain Relational Calculus (DRC), variables take values from *domains* (attributes), whereas in Tuple Relational Calculus (TRC), variables represent *tuples* of relations."
q10,mcq,hard,"Which of the following describes a key characteristic of the 'Shared Nothing' parallel DBMS architecture?","All nodes share a common memory space.|Nodes share disks but have separate memory.|Each node has its own memory and disk, making it highly scalable.|It relies on a centralized dictionary for all data access.",2,"In a 'Shared Nothing' architecture, each node in the distributed system has its own dedicated memory and disk storage. This design eliminates contention points, making it the most scalable parallel DBMS architecture."
q11,mcq,hard,"What is the primary goal of normalization in relational database design?","To increase data redundancy for faster retrieval.|To minimize redundancy and improve data integrity.|To complicate the database schema for security reasons.|To enable direct storage of multi-valued attributes.",1,"The primary goal of normalization is to minimize redundancy and improve the integrity and stability of the database design, helping to handle anomalies."
q12,true_false,hard,"According to First Normal Form (1NF), an attribute must be dependent on its entity's entire UID.",,false,"False. This describes Second Normal Form (2NF). First Normal Form (1NF) requires that all attributes must be single-valued."
q13,mcq,hard,"A transitive dependency, which is prohibited by Third Normal Form (3NF), exists when:","All attributes are single-valued.|An attribute is dependent on its entity's entire UID.|A non-UID attribute is dependent on another non-UID attribute.|All entities have a unique identifier.",2,"A transitive dependency exists when a non-UID attribute in an entity is dependent on another non-UID attribute in that same entity. 3NF aims to eliminate these dependencies."
q14,true_false,hard,"Structural business rules can always be diagrammed in an Entity-Relationship Diagram (ERD).",,true,"True. Structural business rules indicate the types of information to be stored and how they interrelate, making them suitable for diagramming in an ERD."
q15,mcq,hard,"Which type of database security control is implemented through models like Bell-LaPadula and is typically used in high-security environments like military systems?","Discretionary Access Control (DAC)|Mandatory Access Control (MAC)|Role-Based Access Control (RBAC)|Attribute-Based Access Control (ABAC)",1,"Mandatory Access Control (MAC) is used in high-security environments, where access is based on security clearance levels and object classifications, often implemented through models like Bell-LaPadula."
q16,true_false,hard,"RAID 0 (Striping) provides excellent fault tolerance because data is mirrored across multiple disks.",,false,"False. RAID 0 (Striping) offers high performance but provides *no* fault tolerance. If any single disk fails, all data is lost. Fault tolerance is provided by mirroring (RAID 1) or parity (RAID 5/6)."
q17,mcq,hard,"A Distributed DBMS (DDBMS) is characterized by data being logically integrated but physically:", "Centralized in a single server.|Dispersed across networked systems.|Only accessible through a single gateway.|Stored only in read-only replicas.",1,"A Distributed DBMS (DDBMS) manages a database that is logically integrated but physically dispersed across networked systems, providing transparent access to users."
q18,true_false,hard,"In the 'Shared Memory' parallel DBMS architecture, each node has its own memory and disk, making it the most scalable.",,false,"False. The 'Shared Nothing' architecture has each node with its own memory and disk, making it the most scalable. 'Shared Memory' has a common memory space."
q19,mcq,hard,"Which ACID property ensures that a transaction either completes entirely or has no effect at all, meaning all its operations are performed, or none are?", "Consistency|Isolation|Durability|Atomicity",3,"Atomicity ensures that a transaction is treated as a single, indivisible unit of work. It either completes all its operations successfully, or none of them are applied, maintaining the database's consistency."
q20,true_false,hard,"Two-Phase Locking (2PL) can cause cascading rollbacks if a transaction reads uncommitted data from another transaction that later aborts.",,true,"True. If a transaction reads uncommitted data (dirty read) from another transaction that later rolls back, the first transaction may also need to roll back, leading to cascading rollbacks. Strict 2PL prevents this."
q21,mcq,hard,"In deadlock prevention, the 'Wound-Wait' strategy states that:","An older transaction waits for a younger one.|A younger transaction waits for an older one.|An older transaction forces a younger one to abort.|A younger transaction forces an older one to abort.",2,"In 'Wound-Wait', if an older transaction requests a lock held by a younger one, the younger one is aborted (wounded). If a younger transaction requests a lock held by an older one, it waits."
q22,true_false,hard,"Optimistic Concurrency Control assumes that conflicts between transactions are rare and thus does not use locks during transaction execution.",,true,"True. Optimistic Concurrency Control operates on the assumption that conflicts are infrequent. It checks for conflicts only at the commit phase, avoiding locks during the main execution phase."
q23,mcq,hard,"The Relational Algebra operation that selects a subset of tuples based on a given selection condition is denoted by the symbol:","π (pi)|σ (sigma)|ρ (rho)|× (cartesian product)",1,"The SELECT operation, also known as Restriction, is denoted by the sigma (σ) symbol. It filters tuples based on a predicate."
q24,true_false,hard,"The RENAME (ρ) operation in Relational Algebra is a binary operation used for renaming attributes of a relation.",,false,"False. RENAME is a *unary* operation used for renaming attributes of a relation. It operates on a single relation."
q25,mcq,hard,"Which of the following conditions is NOT required for a UNION operation to be valid between two relations R and S?","R and S must have the same number of attributes.|Attribute domains need to be compatible.|Duplicate tuples should be automatically removed by the operation.|R and S must be physically stored in the same database instance.",3,"The first three conditions are standard requirements for a valid UNION operation. The physical storage location is irrelevant to the logical operation of UNION."
q26,true_false,hard,"The result of A - B (Set Difference) includes all tuples that are in B but not in A.",,false,"False. The result of A - B includes all tuples that are in A but *not* in B. The order of operands matters for set difference."
q27,mcq,hard,"Which type of JOIN operation returns only those tuples that satisfy the matching criteria, excluding any non-matching tuples from either relation?","Left Outer Join|Right Outer Join|Full Outer Join|Inner Join",3,"Inner Join returns only the rows that have matching values in both tables, based on the join condition. Outer joins (Left, Right, Full) include non-matching rows."
q28,true_false,hard,"A Semijoin returns one copy of each row in the first table for which at least one match is found in the second table.",,true,"True. A Semijoin (R ⋉ S) defines a relation that contains the tuples of R that participate in the join of R with S, ensuring each row from R appears at most once."
q29,mcq,hard,"Which Relational Algebra operation is required when we want to find entities that are associated with ALL entities of a different relation, often expressed as 'for every' or 'for all' in queries?", "Intersection|Union|Division|Projection",2,"The Division operation is used for 'for every' or 'for all' type queries, finding entities that are associated with all values of another set. SQL does not have a direct division operator but it can be simulated."
q30,true_false,hard,"Relational Calculus is a procedural query language where the user instructs the system step-by-step how to retrieve the desired results.",,false,"False. Relational Calculus is a *non-procedural* query language. The user tells the system what data to retrieve, but not how to retrieve it."
q31,drag_drop,hard,"Match the Normal Form to its definition.","drag1:First Normal Form (1NF)|drag2:Second Normal Form (2NF)|drag3:Third Normal Form (3NF);drop1:All attributes must be single-valued.|drop2:An attribute must be dependent on its entity's entire UID.|drop3:No non-UID attributes can be dependent on another non-UID attribute.;drag1:drop1|drag2:drop2|drag3:drop3","","1NF: All attributes must be single-valued. 2NF: An attribute must be dependent on its entity's entire UID. 3NF: No non-UID attributes can be dependent on another non-UID attribute (prohibits transitive dependencies)."
q32,mcq,hard,"Which of the following is NOT a benefit of normalizing data?","Reduce redundant data.|Increase the integrity of data.|Eliminate data inconsistencies.|Introduce more insert, update, and delete anomalies.",3,"Normalization helps to eliminate insert, update, and delete anomalies, not introduce more of them. It aims to improve data integrity and reduce redundancy."
q33,true_false,hard,"Business rules are solely used to define entities and attributes, not relationships or constraints.",,false,"False. Business rules are used to define entities, attributes, relationships, *and* constraints. They describe how a business operates."
q34,mcq,hard,"In the context of database security, what is the primary weakness of Discretionary Access Control (DAC)?","It requires complex configuration for each user.|It cannot be bypassed by authorized users.|It can be bypassed if authorized users are tricked (e.g., social engineering).|It does not support group-based permissions.",2,"A weakness of DAC is that it can be bypassed if authorized users are tricked, for example, through social engineering attacks, as users manage their own access using privileges."
q35,true_false,hard,"RAID 1 (Mirroring) doubles the storage cost because it keeps an exact duplicate of data on another disk.",,true,"True. RAID 1 duplicates all data, effectively halving the storage efficiency and thus doubling the storage cost for the usable data."
q36,mcq,hard,"Which parallel DBMS architecture is considered the most scalable due to each node having its own memory and disk, eliminating contention points?", "Shared Memory|Shared Disk|Shared Nothing|Centralized Database",2,"The 'Shared Nothing' architecture provides the highest scalability because each node is self-contained with its own memory and disk, minimizing inter-node communication and contention."
q37,true_false,hard,"The Isolation property of ACID ensures that once a transaction is committed, its changes are permanent and survive system failures.",,false,"False. That describes the Durability property. Isolation ensures that concurrent transactions do not interfere with each other."
q38,mcq,hard,"Which concurrency control problem occurs when a transaction reads uncommitted data from another transaction that later aborts, potentially leading to incorrect data?", "Lost Update|Uncommitted Dependency (Dirty Read)|Inconsistent Analysis|Deadlock",1,"Uncommitted Dependency, also known as Dirty Read, occurs when a transaction reads data written by another transaction that has not yet committed. If the writing transaction then aborts, the data read by the first transaction is incorrect."
q39,drag_drop,hard,"Match the Deadlock Solution to its description.","drag1:Timeouts|drag2:Wait-Die|drag3:Wound-Wait;drop1:Aborts transactions if a lock isn't acquired within a time limit.|drop2:Older transactions can wait for younger ones, but younger transactions abort if they request a lock held by an older one.|drop3:Older transactions force younger ones to abort, while younger transactions wait for older ones.;drag1:drop1|drag2:drop2|drag3:drop3","","Timeouts: Aborts transactions if a lock isn't acquired within a time limit. Wait-Die: Older transactions can wait for younger ones, but younger transactions abort if they request a lock held by an older one. Wound-Wait: Older transactions force younger ones to abort, while younger transactions wait for older ones."
q40,mcq,hard,"The Relational Algebra operation used for extracting the values of specified attributes from a relation is:","SELECT (σ)|PROJECT (π)|RENAME (ρ)|UNION (∪)",1,"The PROJECT operation, denoted by pi (π), is used to select specific columns (attributes) from a relation, effectively creating a vertical subset of the table."
q41,true_false,hard,"The SQL command `MINUS` is equivalent to the UNION operation in Relational Algebra.",,false,"False. The SQL command `MINUS` is equivalent to the Set Difference operation in Relational Algebra, not UNION."
q42,mcq,hard,"When is an EQUI JOIN specifically used?", "When any condition is used in the selection criteria.|When only equivalence conditions are used in the selection criteria.|When there is a common attribute between relations with the same name and type.|When all tuples from both relations are included irrespective of matching conditions.",1,"An EQUI JOIN is a special case of a Theta Join where the join condition only uses equivalence (`=`) between attributes."
q43,true_false,hard,"Natural Join requires that there is a common attribute (column) between the relations with the same name and data type.",,true,"True. A Natural Join automatically joins relations based on common attributes that share the same name and data type, and these common columns appear only once in the result."
q44,mcq,hard,"Which type of Outer Join keeps all tuples from the right relation, and if no match is found in the left relation, fills the left relation's attributes with null values?","Left Outer Join|Full Outer Join|Right Outer Join|Inner Join",2,"A Right Outer Join (or RIGHT JOIN) includes all rows from the right table, and matching rows from the left table. If there's no match, NULL values are used for the left table's columns."
q45,true_false,hard,"The Division operator in Relational Algebra is directly supported by a specific keyword in standard SQL.",,false,"False. The Division operation is not directly supported by a single keyword in standard SQL, but it can be expressed using combinations of other operations like Cross Join, IN, and EXISTS."
q46,mcq,hard,"Which type of business rule deals with prerequisites, steps, processes, or workflow requirements of a business, often related to time?", "Structural business rule|Procedural business rule|Integrity business rule|Security business rule",1,"Procedural business rules define the dynamic aspects of a business, such as workflows, sequences of events, and time-dependent conditions."
q47,true_false,hard,"Normalization ensures a better performance of the database primarily by eliminating all data inconsistencies, including those caused by external factors.",,false,"False. Normalization primarily improves performance by minimizing redundancy and handling insert, update, and delete anomalies. While it increases data integrity, it doesn't eliminate *all* data inconsistencies, especially those outside the database design itself."
q48,mcq,hard,"What is the highest normal form generally aimed for in data modeling before transforming the model to a relational design?", "1NF|2NF|3NF|BCNF (Boyce-Codd Normal Form)",2,"The goal is to normalize data to 3NF before transforming the model to your relational design, as stated in the 'Normalization' document."
q49,true_false,hard,"Database security encompasses only the protection of data from intentional threats like hacking.",,false,"False. Database security encompasses protection from both intentional (e.g., hacking) and unintentional threats (e.g., employee error), including theft, unauthorized access, and misuse."
q50,mcq,hard,"Which countermeasure ensures data remains valid and consistent within a database?", "Encryption|Backup and Recovery|Integrity Controls|Authorization",2,"Integrity Controls are mechanisms and rules designed to ensure that data remains valid, consistent, and accurate throughout its lifecycle in the database."
q51,true_false,hard,"Views in a DBMS provide full, unrestricted visibility into data, helping administrators monitor all activities.",,false,"False. Views provide *limited*, controlled visibility into data, which helps enforce confidentiality by restricting what users can see."
q52,mcq,hard,"Which RAID configuration is described as 'Striping with parity' and is ideal for data warehouses due to its balance of performance and fault tolerance?", "RAID 0|RAID 1|RAID 5|RAID 6",2,"RAID 5 provides block-level striping with distributed parity, offering a good balance of performance and fault tolerance, making it suitable for read-heavy applications like data warehouses."
q53,true_false,hard,"A Homogeneous DDBMS requires middleware or gateways to allow communication between different DBMSs and data models.",,false,"False. A Homogeneous DDBMS uses the same DBMS software across all nodes. A Heterogeneous DDBMS requires middleware or gateways for interoperability between different DBMSs and data models."
q54,mcq,hard,"Data fragmentation in a Distributed DBMS can be categorized into which of the following types?", "Centralized and Replicated|Horizontal and Vertical|Static and Dynamic|Active and Passive",1,"Data fragmentation can be Horizontal (rows based on conditions) or Vertical (columns split). Mixed and Derived fragmentation are also types."
q55,true_false,hard,"Date's 12 Rules for distributed systems primarily emphasize complex internal management to optimize network traffic.",,false,"False. Date's 12 Rules emphasize *transparency* (location, fragmentation, replication, etc.) to make distributed systems behave like centralized ones from the user's perspective."
q56,mcq,hard,"Which ACID property states that transactions do not interfere with each other, meaning the execution of one transaction is isolated from others?", "Atomicity|Consistency|Isolation|Durability",2,"Isolation ensures that concurrent execution of transactions leaves the database in the same state that would have been obtained if the transactions were executed serially."
q57,true_false,hard,"A Lost Update anomaly occurs when one transaction reads uncommitted data from another transaction.",,false,"False. A Lost Update occurs when two transactions read the same data, and both update it, but the update of one transaction is overwritten by the other. Reading uncommitted data is an Uncommitted Dependency (Dirty Read)."
q58,mcq,hard,"In Two-Phase Locking (2PL), the 'Growing phase' involves:","Releasing all locks.|Acquiring new locks and releasing existing ones.|Acquiring new locks without releasing any.|Releasing some locks and acquiring others.",2,"The Growing phase in 2PL involves a transaction acquiring new locks but not releasing any. Once it starts releasing locks, it enters the Shrinking phase and cannot acquire any more locks."
q59,true_false,hard,"Timestamping is a concurrency control mechanism that primarily uses shared and exclusive locks to ensure serializability.",,false,"False. Timestamping is an alternative to locking; it orders transactions by their timestamps to ensure serializability without relying on explicit locks."
q60,mcq,hard,"Which technique is used in recovery to periodically store consistent states of the database to minimize the amount of work needed for recovery after a failure?", "Journaling|Transaction Logs|Checkpointing|RAID Technology",2,"Checkpointing periodically saves a consistent state of the database to disk, reducing the amount of data that needs to be redone or undone during recovery after a system failure."
q61,mcq,hard,"Which type of query language instructs the system to perform a series of operations to produce the desired results, where the user tells 'what' and 'how' to retrieve data?", "Non-procedural query language|Declarative query language|Procedural query language|Object-oriented query language",2,"A procedural query language requires the user to specify both what data to retrieve and the step-by-step process (how) to retrieve it, e.g., Relational Algebra."
q62,true_false,hard,"SQL is a theoretical mathematical system used for relational models, similar to Relational Algebra and Relational Calculus.",,false,"False. SQL is a *practical implementation* of relational algebra and relational calculus, whereas Relational Algebra and Relational Calculus are conceptual and theoretical mathematical systems."
q63,mcq,hard,"The operation denoted by the symbol `∪` (Upsilon) in Relational Algebra refers to:", "Intersection|Set Difference|Union|Cartesian Product",2,"The symbol `∪` represents the UNION operation, which combines all distinct tuples from two union-compatible relations."
q64,true_false,hard,"The result of A ∩ B (Intersection) is a relation that includes all tuples that are in A but not in B.",,false,"False. The Intersection (A ∩ B) defines a relation consisting of a set of all tuples that are present in *both* A and B."
q65,mcq,hard,"Which type of JOIN operation can ONLY be performed if there is a common attribute (column) between the relations, and the name and type of that attribute MUST be the same?", "Theta Join|Equijoin|Natural Join|Cross Join",2,"A Natural Join requires that there is at least one common attribute with the same name and data type between the relations it is joining."
q66,true_false,hard,"A Full Outer Join includes all tuples from the left relation and only matching tuples from the right relation.",,false,"False. A Full Outer Join includes all tuples from *both* relations, irrespective of whether they have matching conditions. Null values are filled where no match exists."
