id,type,difficulty,question,options,correct_answer,explanation
java_q42,write_full_code,hard,"Write the JavaFX code to create a `Button` with the text ""OK"" and an `ImageView` displaying an image from the URL `https://placehold.co/30x30/000000/FFFFFF?text=ICON`. The image should be 30x30 pixels. The button should have the image to its left.",,"```java\nimport javafx.application.Application;\nimport javafx.scene.Scene;\nimport javafx.scene.control.Button;\nimport javafx.scene.image.Image;\nimport javafx.scene.image.ImageView;\nimport javafx.scene.layout.StackPane;\nimport javafx.stage.Stage;\n\npublic class ButtonWithGraphic extends Application {\n    @Override\n    public void start(Stage primaryStage) {\n        // Load the image\n        Image iconImage = new Image(\"[https://placehold.co/30x30/000000/FFFFFF?text=ICON](https://placehold.co/30x30/000000/FFFFFF?text=ICON)\", 30, 30, true, true);\n        ImageView iconImageView = new ImageView(iconImage);\n\n        // Create the button with text and graphic\n        Button button = new Button(\"OK\", iconImageView);\n\n        StackPane root = new StackPane();\n        root.getChildren().add(button);\n        Scene scene = new Scene(root, 200, 100);\n\n        primaryStage.setTitle(\"Button with Icon\");\n        primaryStage.setScene(scene);\n        primaryStage.show();\n    }\n\n    public static void main(String[] args) {\n        launch(args);\n    }\n}\n```",,"This code uses the `Image` and `ImageView` classes to load and display an image. The `Button` constructor `Button(String text, Node graphic)` is used to place the `ImageView` (which is a `Node`) directly within the button, to the left of the text by default."
java_q43,mcq,hard,"Which of the following is a drawback of using named inner classes for event handling in JavaFX?", "They cannot access outer class members.|They make the code more concise.|They are designed to be shared by multiple applications.|They might lead to more verbose code for simple, one-time handlers.",3,"Named inner classes can increase verbosity for simple event handlers that are only used once, as they require a separate class definition. Anonymous inner classes or lambda expressions are often preferred for conciseness in such cases."
java_q44,true_false,hard,"JavaFX's `MediaPlayer` class includes properties like `autoPlay`, `volume`, and `totalDuration` to control media playback.",,true,"True. `MediaPlayer` provides comprehensive control over media playback, including `autoPlay` for automatic start, `volume` for audio level, and `totalDuration` for media length."
java_q45,fill_in_the_blank,hard,"The `TableView` UI control in JavaFX is used to display data in a `______` format.", "tabular",,"The `TableView` control is designed to display data in a `tabular` format, with rows and columns, for structured data presentation."
java_q46,drag_drop,hard,"Match the JavaFX `ScrollBar` property to its function.","drag1:min|drag2:max|drag3:value|drag4:unitIncrement|drag5:blockIncrement;drop1:The minimum value represented by this scroll bar.|drop2:The maximum value represented by this scroll bar.|drop3:Current value of the scroll bar.|drop4:Amount to adjust when increment/decrement methods are called.|drop5:Amount to adjust if track of the bar is clicked.;drag1:drop1|drag2:drop2|drag3:drop3|drag4:drop4|drag5:drop5","","`min` and `max` define the range. `value` is the current position. `unitIncrement` is for small adjustments (arrow clicks). `blockIncrement` is for larger adjustments (track clicks)."
java_q47,trace_the_output,hard,"Given the `SliderDemo` code snippet for value change listener, what is printed if the slider `newValue` is 42.99?\n```java\n// ... in a ChangeListener<Number> for a Slider's valueProperty()\npublic void changed(ObservableValue<? extends Number> observable, Number oldValue, Number newValue) {\n    System.out.println(String.valueOf(newValue.intValue()));\n}\n// ...\n```", "42",,"The `intValue()` method truncates the decimal part of a `Number` (like `Double`). So, 42.99 becomes 42 when converted to an `int`."
java_q48,write_full_code,hard,"Write the basic Java code for a simple `Button` and its `ActionEvent` handler using a Lambda Expression that prints ""Button clicked!"" to the console.",,"```java\nimport javafx.application.Application;\nimport javafx.scene.Scene;\nimport javafx.scene.control.Button;\nimport javafx.scene.layout.StackPane;\nimport javafx.stage.Stage;\n\npublic class LambdaButton extends Application {\n    @Override\n    public void start(Stage primaryStage) {\n        Button btn = new Button(\"Lambda Button\");\n        \n        // Using a Lambda Expression for the event handler\n        btn.setOnAction(event -> {\n            System.out.println(\"Button clicked!\");\n        });\n\n        StackPane root = new StackPane();\n        root.getChildren().add(btn);\n        Scene scene = new Scene(root, 200, 100);\n\n        primaryStage.setTitle(\"Lambda Demo\");\n        primaryStage.setScene(scene);\n        primaryStage.show();\n    }\n\n    public static void main(String[] args) {\n        launch(args);\n    }\n}\n```",,"This code demonstrates the concise syntax of a lambda expression for handling a button's action event. The `event -> { ... }` is a direct implementation of the `EventHandler` functional interface."
java_q49,mcq,hard,"Which of the following event types is NOT a direct subclass of `MouseEvent` in JavaFX?", "Mouse pressed|Mouse released|Mouse clicked|Key pressed",3,"`Key pressed` events are handled by `KeyEvent`, which is a subclass of `InputEvent`, but not directly a `MouseEvent`. `Mouse pressed`, `Mouse released`, and `Mouse clicked` are all `MouseEvent` types."
java_q50,true_false,hard,"JavaFX is prone to platform-specific bugs, similar to AWT.",,false,"False. JavaFX, like Swing, aims to be less prone to platform-specific bugs compared to AWT, as it paints components directly using Java code rather than relying heavily on native GUI resources."
java_q51,mcq,hard,"What is the primary role of an `ObservableList` in JavaFX, especially when used with UI controls like `ComboBox` or `ListView`?", "It stores data as a fixed-size array for performance.|It is a utility for parsing JSON data into Java objects.|It provides an observable collection of items that can automatically update the UI when changes occur.|It defines the styling properties for UI controls.",2,"`ObservableList` is a key JavaFX interface that provides a dynamic, observable collection. When its contents change (items added, removed, or modified), it notifies its listeners, allowing bound UI controls to automatically update and reflect these changes without manual intervention."
java_q52,true_false,hard,"The `TextField` control in JavaFX is primarily designed for entering or displaying multiple lines of text.",,false,"False. `TextField` is for single-line text input. `TextArea` is designed for multiple lines of text."
java_q53,fill_in_the_blank,hard,"In JavaFX, the `Media` class is used to obtain the `______` of the media.", "source",,"The `Media` class represents the media resource itself and is used to obtain its `source` (e.g., a URL to a video file)."
java_q54,drag_drop,hard,"Match the `MediaPlayer` property to its function.","drag1:autoPlay|drag2:cycleCount|drag3:mute|drag4:volume;drop1:Specifies whether playback should start automatically.|drop2:Specifies the number of times the media will be played.|drop3:Specifies whether the audio is muted.|drop4:The volume level for the audio.;drag1:drop1|drag2:drop2|drag3:drop3|drag4:drop4","","`autoPlay` controls automatic playback. `cycleCount` sets repetition. `mute` mutes audio. `volume` controls audio level."
java_q55,trace_the_output,hard,"Analyze the output of the following Java code given the `Department` and `Professor` classes from the 'Aggregation' example.\n```java\npublic class Main {\n    public static void main(String[] args) {\n        Professor p1 = new Professor(\"Dr. Smith\", \"Physics\");\n        Professor p2 = new Professor(\"Dr. Jones\", \"Chemistry\");\n        Department science = new Department(\"Science\");\n        science.addProfessor(p1);\n        science.addProfessor(p2);\n        for (Professor p : science.getProfessors()) {\n            p.teach();\n        }\n    }\n}\n// Assume Professor and Department classes are defined as in the Class Relationships example.\n```", "Dr. Smith is teaching Physics\nDr. Jones is teaching Chemistry",,"The code creates two `Professor` objects and adds them to a `Department`. It then iterates through the list of professors in the department and calls the `teach()` method on each, resulting in their specific teaching messages being printed."
java_q56,write_full_code,hard,"Write the JavaFX code to load and play a video from a mock URL `http://example.com/mock_video.mp4` using `Media`, `MediaPlayer`, and `MediaView`. Do not include UI controls, just the basic media display.",,"```java\nimport javafx.application.Application;\nimport javafx.scene.Scene;\nimport javafx.scene.layout.StackPane;\nimport javafx.scene.media.Media;\nimport javafx.scene.media.MediaPlayer;\nimport javafx.scene.media.MediaView;\nimport javafx.stage.Stage;\n\npublic class SimpleMediaPlayback extends Application {\n\n    private static final String VIDEO_URL = \"[http://example.com/mock_video.mp4](http://example.com/mock_video.mp4)\";\n\n    @Override\n    public void start(Stage primaryStage) {\n        // Create Media object from URL\n        Media media = new Media(VIDEO_URL);\n\n        // Create MediaPlayer\n        MediaPlayer mediaPlayer = new MediaPlayer(media);\n        mediaPlayer.setAutoPlay(true); // Start playing automatically\n\n        // Create MediaView to display the media\n        MediaView mediaView = new MediaView(mediaPlayer);\n\n        // Add MediaView to a layout pane\n        StackPane root = new StackPane();\n        root.getChildren().add(mediaView);\n\n        // Set up the scene and stage\n        Scene scene = new Scene(root, 640, 480);\n        primaryStage.setTitle(\"Video Playback\");\n        primaryStage.setScene(scene);\n        primaryStage.show();\n\n        // Ensure media player is stopped when stage is closed\n        primaryStage.setOnCloseRequest(event -> mediaPlayer.stop());\n    }\n\n    public static void main(String[] args) {\n        launch(args);\n    }\n}\n```",,"This code demonstrates the basic usage of `Media` to define the source, `MediaPlayer` to control playback (with `setAutoPlay(true)` to start automatically), and `MediaView` to display the visual component of the media. A mock URL is used as actual video files cannot be directly embedded."
java_q57,mcq,hard,"Which of the following scenarios best represents an 'Association' relationship?", "A `Car` having `Engines` where an `Engine` cannot exist without a `Car`.\nA `Student` taking `Courses`, where both can exist independently.\nA `Dog` being a type of `Animal`.\nAn `Employee` managing other `Employee`s in a hierarchy.",1,"Association is a ""uses"" relationship where one class interacts with another, but neither owns the other. A `Student` taking `Courses` is a classic example: a student can exist without taking a course, and a course can exist without a particular student enrolled."
java_q58,true_false,hard,"The `Font` class in JavaFX allows setting the font size, name, and family.",,true,"True. The `Font` class provides properties and constructors to define the font's size, name (e.g., ""Arial""), and style (e.g., bold, italic), which includes its family."
java_q59,fill_in_the_blank,hard,"When dealing with `MouseEvent` in JavaFX, `getSceneX()` returns the x-coordinate of the mouse point relative to the `______`.", "scene",,"`getSceneX()` and `getSceneY()` provide the mouse coordinates relative to the `Scene` itself, regardless of the specific node that received the event."
java_q60,drag_drop,hard,"Match the JavaFX property type to its basic use.","drag1:StringProperty|drag2:DoubleProperty|drag3:BooleanProperty|drag4:ObjectProperty;drop1:Observable wrapper for a String value.|drop2:Observable wrapper for a double value.|drop3:Observable wrapper for a boolean value.|drop4:Observable wrapper for any Object.;drag1:drop1|drag2:drop2|drag3:drop3|drag4:drop4","","`StringProperty` wraps `String`. `DoubleProperty` wraps `double`. `BooleanProperty` wraps `boolean`. `ObjectProperty` wraps any `Object` type."
java_q61,trace_the_output,hard,"Given the `ObservablePropertyDemo` context, what will be printed if `balance.set(0.0)` is called after `balance.set(4.5)`?\n```java\nimport javafx.beans.property.DoubleProperty;\nimport javafx.beans.property.SimpleDoubleProperty;\nimport javafx.beans.value.Observable;\nimport javafx.beans.value.InvalidationListener;\n\npublic class ObservableDemo {\n    public static void main(String[] args) {\n        final DoubleProperty balance = new SimpleDoubleProperty();\n        balance.addListener(new InvalidationListener() {\n            @Override\n            public void invalidated(Observable ov) {\n                System.out.println(\"The new value is \" + balance.doubleValue());\n            }\n        });\n        balance.set(4.5);\n        balance.set(0.0);\n    }\n}\n```", "The new value is 4.5\nThe new value is 0.0",,"The `InvalidationListener` is triggered every time the property's value *changes*. So, both `balance.set(4.5)` (changing from default 0.0 to 4.5) and `balance.set(0.0)` (changing from 4.5 to 0.0) will trigger the `invalidated` method, printing the new value each time."
java_q62,write_full_code,hard,"Write the JavaFX code to create two `RadioButton`s, 'Option A' and 'Option B', that belong to the same `ToggleGroup` so only one can be selected at a time. Display them in a `VBox`.",,"```java\nimport javafx.application.Application;\nimport javafx.scene.Scene;\nimport javafx.scene.control.RadioButton;\nimport javafx.scene.control.ToggleGroup;\nimport javafx.scene.layout.VBox;\nimport javafx.stage.Stage;\n\npublic class RadioButtonGroup extends Application {\n    @Override\n    public void start(Stage primaryStage) {\n        RadioButton rb1 = new RadioButton(\"Option A\");\n        RadioButton rb2 = new RadioButton(\"Option B\");\n\n        ToggleGroup group = new ToggleGroup();\n        rb1.setToggleGroup(group);\n        rb2.setToggleGroup(group);\n\n        VBox root = new VBox(10); // Spacing of 10\n        root.getChildren().addAll(rb1, rb2);\n        Scene scene = new Scene(root, 200, 150);\n\n        primaryStage.setTitle(\"Radio Button Group\");\n        primaryStage.setScene(scene);\n        primaryStage.show();\n    }\n\n    public static void main(String[] args) {\n        launch(args);\n    }\n}\n```",,"This code creates a `ToggleGroup` and assigns both `RadioButton`s to it using `setToggleGroup()`. This ensures that only one radio button within that group can be selected at any given time, providing mutual exclusivity."
java_q63,mcq,hard,"What is the significance of the `Override` annotation in the `handle` method of an `EventHandler` implementation?", "It forces the method to be static.|It indicates that the method is a new method not found in the interface.|It signals that the method is implementing or overriding a method from a superclass or interface.|It optimizes the method's performance.",2,"The `@Override` annotation is a compiler directive indicating that the method is intended to override or implement a method from a superclass or an interface. It helps catch potential errors, like typos in method names, that would otherwise lead to a new method being defined instead of an override."
java_q64,true_false,hard,"The `ScrollBar` control in JavaFX can only appear in a horizontal orientation.",,false,"False. The `ScrollBar` control can appear in both horizontal and vertical orientations, determined by its `orientation` property."
java_q65,fill_in_the_blank,hard,"JavaFX `ImageView` provides `fitWidth` and `fitHeight` properties, which specify the `______` of the bounding box within which the image is resized to fit.", "width and height",,"`fitWidth` and `fitHeight` control the dimensions of the bounding box for image resizing within the `ImageView`."
java_q66,drag_drop,hard,"Match the JavaFX `ComboBox` property to its function.","drag1:value|drag2:editable|drag3:onAction|drag4:items;drop1:The value selected in the combo box.|drop2:Specifies whether the combo box allows user input.|drop3:Specifies the handler for processing the action event.|drop4:The items in the combo box popup.;drag1:drop1|drag2:drop2|drag3:drop3|drag4:drop4","","`value` is the selected item. `editable` allows user input. `onAction` is the event handler. `items` holds the list of choices."
java_q67,trace_the_output,hard,"What is the output of this code snippet, demonstrating `ListView` selection?\n```java\nimport javafx.application.Application;\nimport javafx.collections.FXCollections;\nimport javafx.scene.Scene;\nimport javafx.scene.control.ListView;\nimport javafx.scene.layout.VBox;\nimport javafx.stage.Stage;\n\npublic class ListViewDemo extends Application {\n    @Override\n    public void start(Stage primaryStage) {\n        String[] items = {\"Apple\", \"Banana\", \"Cherry\"};\n        ListView<String> listView = new ListView<>(FXCollections.observableArrayList(items));\n        listView.getSelectionModel().select(1); // Selects the second item (index 1)\n        listView.getSelectionModel().selectedItemProperty().addListener((obs, oldVal, newVal) -> {\n            System.out.println(\"Selected: \" + newVal);\n        });\n\n        VBox root = new VBox(listView);\n        primaryStage.setScene(new Scene(root, 200, 150));\n        primaryStage.show();\n    }\n    public static void main(String[] args) {\n        launch(args);\n    }\n}\n// No user interaction after initial selection.\n```", "Selected: Banana",,"The `listView.getSelectionModel().select(1);` programmatically selects the item at index 1 ("Banana"). This action triggers the `selectedItemProperty()` listener, which then prints the newly selected value to the console."
java_q68,write_full_code,hard,"Write the JavaFX code to create a `CheckBox` labeled ""Bold"" and another labeled ""Italic"". Set the ""Bold"" checkbox to be initially selected.",,"```java\nimport javafx.application.Application;\nimport javafx.scene.Scene;\nimport javafx.scene.control.CheckBox;\nimport javafx.scene.layout.VBox;\nimport javafx.stage.Stage;\n\npublic class CheckBoxDemo extends Application {\n    @Override\n    public void start(Stage primaryStage) {\n        CheckBox boldCheckBox = new CheckBox(\"Bold\");\n        CheckBox italicCheckBox = new CheckBox(\"Italic\");\n\n        boldCheckBox.setSelected(true); // Set 'Bold' as initially selected\n\n        VBox root = new VBox(10); // Spacing of 10\n        root.getChildren().addAll(boldCheckBox, italicCheckBox);\n        Scene scene = new Scene(root, 200, 150);\n\n        primaryStage.setTitle(\"Check Box Demo\");\n        primaryStage.setScene(scene);\n        primaryStage.show();\n    }\n\n    public static void main(String[] args) {\n        launch(args);\n    }\n}\n```",,"This code creates two `CheckBox` controls. The `setSelected(true)` method is used on the `boldCheckBox` to make it appear checked from the start. Both are added to a `VBox` for vertical arrangement."
java_q69,mcq,hard,"Which of the following is NOT true about `ActionEvent` in JavaFX?", "It is a subclass of `Event`.|It represents events triggered by ""actions"" like a button click.|It is a generic type parameter indicating the type of event an `EventHandler` will handle.|It can hold information about the event itself in its `event` parameter.",2,"`<ActionEvent>` itself is *not* a generic type parameter; it is the concrete type of event. `EventHandler<T>` has `T` as a generic type parameter, and `ActionEvent` is often passed as `T`."
java_q70,true_false,hard,"The `ImageView` class creates an `Image` with contents loaded from a file or URL.",,false,"False. The `Image` class creates an `Image` with contents loaded from a file or URL. The `ImageView` class is then used to *display* an `Image` object."
java_q71,fill_in_the_blank,hard,"The `______` class in JavaFX provides core functionality for all animations.", "Animation",,"The `Animation` class serves as the abstract base class for all animations in JavaFX, providing fundamental properties and methods like `play()`, `pause()`, `stop()`."
java_q72,drag_drop,hard,"Match the JavaFX object to its general purpose.","drag1:Stage|drag2:Scene|drag3:Node|drag4:Control|drag5:Shape;drop1:Top-level window for JavaFX applications.|drop2:Container for all graphical content within a stage.|drop3:Abstract base class for all items in the scene graph.|drop4:Base class for interactive UI components.|drop5:Base class for drawing geometric figures.;drag1:drop1|drag2:drop2|drag3:drop3|drag4:drop4|drag5:drop5","","`Stage` is the window. `Scene` is the content holder. `Node` is the base for all graphical elements. `Control` is for UI components. `Shape` is for drawing."
java_q73,trace_the_output,hard,"What is the output from `myHouse.getAddress()` if `myHouse` is created as `new House(""123 Main St"")`?\n```java\npublic class House {\n    private String address;\n    private List<Room> rooms = new ArrayList<>();\n    public House(String address) { this.address = address; }\n    public void addRoom(String type, int size) { rooms.add(new Room(type, size)); }\n    public String getAddress() { return address; }\n}\n// Assume Room class is defined.\n```", "123 Main St",,"The `getAddress()` method of the `House` class simply returns the `address` string that was passed to its constructor, which is ""123 Main St""."
java_q74,write_full_code,hard,"Write the JavaFX code to create a `Slider` with a range from 0 to 100, an initial value of 50, and display its current integer value in a `Label` that updates dynamically as the slider is moved. Use `valueProperty().addListener`.",,"```java\nimport javafx.application.Application;\nimport javafx.beans.value.ChangeListener;\nimport javafx.beans.value.ObservableValue;\nimport javafx.scene.Scene;\nimport javafx.scene.control.Label;\nimport javafx.scene.control.Slider;\nimport javafx.scene.layout.VBox;\nimport javafx.stage.Stage;\n\npublic class SliderWithLabel extends Application {\n    @Override\n    public void start(Stage primaryStage) {\n        Label valueLabel = new Label(\"50\"); // Initial value display\n\n        Slider slider = new Slider(0, 100, 50); // Min, Max, Initial Value\n        slider.setShowTickLabels(true); // Optional: show numerical labels\n        slider.setShowTickMarks(true); // Optional: show tick marks\n\n        // Add listener to update label\n        slider.valueProperty().addListener(new ChangeListener<Number>() {\n            @Override\n            public void changed(ObservableValue<? extends Number> observable, Number oldValue, Number newValue) {\n                valueLabel.setText(String.valueOf(newValue.intValue()));\n            }\n        });\n\n        VBox root = new VBox(10); // Spacing\n        root.getChildren().addAll(slider, valueLabel);\n        Scene scene = new Scene(root, 300, 150);\n\n        primaryStage.setTitle(\"Slider Label Demo\");\n        primaryStage.setScene(scene);\n        primaryStage.show();\n    }\n\n    public static void main(String[] args) {\n        launch(args);\n    }\n}\n```",,"This code sets up a `Slider` and a `Label`. A `ChangeListener` is added to the `slider.valueProperty()` to react to changes in the slider's value. The `changed` method updates the `valueLabel`'s text using the integer part of the new value from the slider."
java_q75,mcq,hard,"What is the key principle behind 'Event-Driven Programming'?", "Code executes in a strict, predefined sequential order.|Code execution is primarily determined by object interactions and method calls.|Code execution is triggered and controlled by events generated by user actions or system notifications.|Code is written in a functional style to avoid side effects.",2,"In event-driven programming, the flow of the program is determined by events. Instead of following a strict sequential path, the program waits for events to occur (like a button click, key press, or network data arrival) and then executes specific code (event handlers) in response to those events."
java_q76,true_false,hard,"A `ComboBox` in JavaFX can only display a static list of items that cannot be updated dynamically.",,false,"False. `ComboBox`s, along with `ListView`s, use `ObservableList`s for their items. `ObservableList`s can be dynamically updated (items added, removed, or changed), and the UI will automatically reflect these changes."
java_q77,fill_in_the_blank,hard,"The `______` class is the base class for all graphical elements in the JavaFX scene graph.", "Node",,"`Node` is the fundamental building block in the JavaFX scene graph, serving as the base class for all visual elements like shapes, controls, and panes."
java_q78,drag_drop,hard,"Match the JavaFX coordinate system property to its characteristic.","drag1:JavaFX Coordinate System (0,0)|drag2:Conventional Coordinate System (0,0);drop1:Top-left corner of the drawing area.|drop2:Center of the drawing area.;drag1:drop1|drag2:drop2","","The JavaFX coordinate system places the origin (0,0) at the top-left corner. The conventional coordinate system places the origin (0,0) at the center."
