id,type,difficulty,question,options,correct_answer,explanation
q67,mcq,hard,"When the Division operation is performed as $R(x,y) / S(y)$, the attributes of the resulting relation will be:", "All attributes of R.|All attributes of S.|All attributes of R minus all attributes of S.|All attributes of R plus all attributes of S.",2,"The relation returned by the division operator will have attributes equal to (All attributes of A - All Attributes of B), so in $R(x,y) / S(y)$, the result would have attribute x."
q68,true_false,hard,"Aggregate functions like SUM and AVG can only be applied to numerical attributes.",,false,"False. While SUM and AVG are primarily for numerical attributes, other aggregate functions like COUNT, MIN, and MAX can be applied to non-numerical attributes as well."
q69,mcq,hard,"Which of the following is a key characteristic of Domain Relational Calculus (DRC)?","Variables take values from tuples of relations.|It uses SQL syntax exclusively.|Records are filtered based on the domains (attributes) of relations.|It is a procedural query language.",2,"In Domain Relational Calculus (DRC), variables take values from domains (attributes) of relations, allowing records to be filtered based on these domain values."
q70,true_false,hard,"Transform-oriented languages like SQL are examples of procedural query languages.",,false,"False. Transform-oriented languages like SQL are generally considered *non-procedural* (or declarative) languages, as users specify what they want without detailing the step-by-step process."
q71,mcq,hard,"Which of the following is an anomaly that normalization helps to eliminate?","Increased query execution time.|The need for more complex queries.|Insert, update, and delete anomalies.|The inability to store complex data types.",2,"Normalization specifically addresses and helps to eliminate insert, update, and delete anomalies, which are data inconsistencies that can arise from redundant data."
q72,true_false,hard,"A business rule like 'Customers whose account balances are 90 days overdue will not be permitted to charge additional orders' can typically be fully diagrammed within an ERD.",,false,"False. This is a procedural business rule with time-based logic and conditions that often require additional programming to implement, rather than being fully represented in a static ERD."
q73,mcq,hard,"What is the term for a circular wait between two or more transactions, where each is waiting for a resource held by the other, preventing any from proceeding?", "Lost Update|Dirty Read|Deadlock|Inconsistent Analysis",2,"Deadlock occurs when two or more transactions are in a circular waiting pattern for resources that each other holds, causing them to be permanently blocked."
q74,true_false,hard,"The Bell-LaPadula model, used in Mandatory Access Control (MAC), primarily focuses on preventing data leaks down the classification chain.",,true,"True. The Bell-LaPadula model is a state machine model that enforces 'no read up' and 'no write down' rules, specifically designed to prevent information from flowing from a higher security level to a lower one (data leaks)."
q75,mcq,hard,"Which RAID level involves 'Block-Level Striping with Double Parity' and is often ideal for large enterprise databases where availability is critical, even at the cost of slower write performance?", "RAID 0|RAID 1|RAID 5|RAID 6",3,"RAID 6 provides two parity blocks, enabling it to tolerate two simultaneous disk failures, making it highly fault-tolerant for mission-critical enterprise systems, though write performance can be slower due to double parity calculations."
q76,true_false,hard,"In a Heterogeneous DDBMS, all nodes use the same DBMS software.",,false,"False. In a Heterogeneous DDBMS, different DBMSs and data models are used across the nodes, often requiring middleware for integration."
q77,mcq,hard,"Which of the following is NOT a challenge associated with Distributed DBMSs?", "Increased reliability|Design and maintenance complexity|Expensive infrastructure|Challenges in integrity and security",0,"Increased reliability is an *advantage* of DDBMSs, as data replication and distribution can ensure availability even if some nodes fail. The others are disadvantages."
q78,true_false,hard,"Journaling in DBMSs is a hardware-based fault tolerance technology.",,false,"False. Journaling is a software-based recovery technique that logs changes to the database for auditing and recovery purposes. RAID technology is hardware-based fault tolerance."
q79,mcq,hard,"The 'Inconsistent Analysis' problem in concurrency control typically arises when a transaction reads values that are then updated by another transaction, leading to inconsistent aggregate calculations. This is also known as:", "Phantom Read|Dirty Read|Non-repeatable Read|Lost Update",0,"Inconsistent Analysis, or Phantom Read, occurs when a transaction re-reads a range of data and finds that the set of rows has changed (e.g., new rows added or existing rows deleted) due to another concurrent transaction."
q80,true_false,hard,"The 'Shrinking phase' in Two-Phase Locking (2PL) allows a transaction to acquire new locks.",,false,"False. In the Shrinking phase, a transaction can *only* release locks; it cannot acquire any new ones."
q81,mcq,hard,"When using Timestamping for concurrency control, a transaction is typically aborted if:", "It tries to acquire a lock already held by another transaction.|Its read timestamp is older than the write timestamp of the data item it wants to read.|Its write timestamp is older than the read timestamp of the data item it wants to write.|It detects a cycle in the Wait-For Graph.",2,"In timestamping, if a transaction T attempts to write a data item X, but T's write timestamp is older than X's read timestamp (meaning a younger transaction has already read X), T is typically aborted to prevent an inconsistent read by the younger transaction."
q82,true_false,hard,"Optimistic Concurrency Control is generally more efficient in environments with very high data contention and frequent conflicts.",,false,"False. Optimistic Concurrency Control performs better in environments with *low* data contention, as its rollback rate increases significantly with frequent conflicts due to validations at commit time."
q83,mcq,hard,"The aggregate operation in relational algebra is denoted by which symbol, often used for grouping and applying functions like AVG, SUM, COUNT?", "σ (sigma)|π (pi)|G (Calligraphic G/Gamma)|ρ (rho)",2,"The calligraphic G or Gamma symbol is used to denote the aggregate operation (sometimes represented as Y in some texts), which allows grouping and applying aggregate functions like AVG, SUM, COUNT, MIN, MAX."
q84,true_false,hard,"In Tuple Relational Calculus (TRC), variables represent attributes of relations, not entire tuples.",,false,"False. In Tuple Relational Calculus (TRC), variables represent *tuples* of relations. In Domain Relational Calculus (DRC), variables represent attributes (domains)."
q85,mcq,hard,"A 4GL (Fourth-Generation Language) is characterized by being:", "Closer to machine language than other high-level languages.|Only usable for scientific calculations.|Designed to be easier for users than older high-level languages, often menu-driven.|A theoretical language with no practical implementation.",2,"4GLs are designed to be more user-friendly and closer to human language than earlier programming languages, often providing features like menu-driven interfaces for rapid application development."
q86,true_false,hard,"An SQL query like `SELECT * FROM emp, dept WHERE dept.deptno = emp.deptno` is an example of a meaningful Cartesian Product followed by a selection.",,true,"True. This SQL query, without an explicit JOIN keyword, implicitly performs a Cartesian Product and then filters the result based on the WHERE clause, which is essentially an Inner Join."
q87,mcq,hard,"Which of the following is a primary characteristic of a 'Query Language'?", "It is used for designing database schemas only.|It is used to store and retrieve data from the database.|It is a programming language for general-purpose applications.|It is used for network configuration.",1,"A query language is specifically designed for interacting with databases to store, retrieve, modify, and manage data."
q88,true_false,hard,"The term 'uncommitted dependency' is another name for a 'Lost Update' in concurrency control.",,false,"False. 'Uncommitted dependency' is another name for a 'Dirty Read', not a 'Lost Update'."
q89,mcq,hard,"Which type of business rule details a specific, static aspect of the business and indicates the types of information to be stored and how they interrelate?", "Procedural business rule|Dynamic business rule|Structural business rule|Temporal business rule",2,"Structural business rules define the static, inherent aspects of a business's data and how information elements are structured and related, making them directly diagrammable in an ERD."
q90,true_false,hard,"Microsoft Access DBMS security features include user-level security and group-based permissions.",,true,"True. Microsoft Access supports user-level security, allowing privileges to be set per user, and group-based permissions for managing larger sets of users."
q91,mcq,hard,"Which of Date's 12 Rules specifically aims to hide the physical location of data from users in a distributed database?", "Network Transparency|Replication Transparency|Fragmentation Transparency|Location Transparency",3,"Location Transparency is one of Date's 12 rules, ensuring that users do not need to know the physical location of data in a distributed database."
q92,true_false,hard,"The principle of 'No Preemption' in deadlock conditions means that resources can be forcibly taken away from a transaction.",,false,"False. 'No Preemption' means that resources *cannot* be forcibly taken away from a transaction that is holding them. This is one of the four necessary conditions for a deadlock to occur."
q93,mcq,hard,"What does the SQL query `SELECT DISTINCT SID FROM Suppliers x WHERE NOT EXISTS (SELECT * FROM parts y WHERE NOT EXISTS (SELECT SID FROM suppliers z WHERE z.sid = x.sid AND z.pid = y.pid ))` achieve?", "It finds suppliers who supply at least one part.|It finds suppliers who supply no parts.|It finds suppliers who supply all parts.|It finds parts supplied by all suppliers.",2,"This SQL query is a common way to simulate the Relational Algebra Division operation, finding entities (suppliers) that are associated with all instances of another entity (parts)."
q94,true_false,hard,"In data modeling, 'UID' stands for 'Unique Identifier'.",,true,"True. UID is commonly used in data modeling to refer to a Unique Identifier, often equivalent to a Primary Key in a relational database."
q95,mcq,hard,"When designing a database, what is the process of organizing attributes and tables of a relational database to minimize redundancy and handle anomalies?", "Indexing|Partitioning|Normalization|Denormalization",2,"Normalization is the systematic process of structuring a relational database to reduce data redundancy and improve data integrity."
q96,true_false,hard,"The concept of 'Additional Programming' for business rules refers exclusively to rules that can be fully modeled in an ERD but need a programming language to execute.",,false,"False. Additional programming is typically needed for procedural rules that *cannot* be fully modeled in an ERD (e.g., complex calculations, time-dependent logic), meaning they need to be implemented as processes that interact with data."
q97,mcq,hard,"Which type of query language is PROLOG an example of?", "3GL|4GL|5GL|Procedural Language",2,"PROLOG (PROgramming LOGic) is mentioned as an example of a 5GL, which is a programming language based on problem-solving using constraints, still at an early stage."
q98,true_false,hard,"The `COUNT` aggregate function can only be used on primary key attributes.",,false,"False. `COUNT` can be used on any attribute (or `COUNT(*)`) to count the number of values or rows, not just primary key attributes."
q99,mcq,hard,"What is the term for logging all operations performed on a database to enable recovery and auditing?", "Checkpointing|Mirroring|Journaling|Striping",2,"Journaling, or logging, involves maintaining a transaction log that records all changes made to the database, which is crucial for recovery (rollback/redo) and auditing."
q100,drag_drop,hard,"Match the query language type to its description.","drag1:Procedural Query language|drag2:Non-procedural query language;drop1:User tells what data to be retrieved and how to retrieve it.|drop2:User tells what data to be retrieved but doesn't tell how to retrieve it.;drag1:drop1|drag2:drop2","","Procedural Query language: User tells what data to be retrieved and how to retrieve it. Non-procedural query language: User tells what data to be retrieved but doesn't tell how to retrieve it."
